ID,Summary,Parent Interest ID,Registered,Published,Updated_1,Category,MNIS ID,Member,JobTitle,StartDate,EndDate,IsUntilFurtherNotice,PayerName,PayerIsPrivateIndividual,IsPaidAsDirectorOfPayer,PayerNatureOfBusiness,PayerPublicAddress,HasSoughtAcobaAdvice,Link,Updated_2,Updated_3,Updated_4,Updated_5,Updated_6,Updated_7,Updated_8
5770,Speaking Engagements - XTX Markets,,,2024-05-17,,Employment and earnings,4125,Catherine McKinnell,Speaking Engagements,,,False,XTX Markets,False,False,,"R7, 14-18 Handyside Street, London N1C 4DN",,https://interests-api.parliament.uk/api/v1/Interests/5770,,,,,,,
5737,Training - Civil Service College,,2024-05-14,2024-05-16,,Employment and earnings,4065,Dame Jackie Doyle-Price,Training,,,False,Civil Service College,False,False,training provider,"25 Queen Anne’s Gate, St James’s, London SW1H 9BU",False,https://interests-api.parliament.uk/api/v1/Interests/5737,,,,,,,
5774,Appearances on ITV's This Morning show - ITV PLC,,,2024-05-16,,Employment and earnings,4573,Dr Rosena Allin-Khan,Appearances on ITV's This Morning show,,,False,ITV PLC,False,False,,"ITV White City, 201 Wood Lane, London W12 7RU",,https://interests-api.parliament.uk/api/v1/Interests/5774,,,,,,,
5606,Interview Fee - Faber and Faber,,,2024-05-14,,Employment and earnings,4764,Bell Ribeiro-Addy,Interview Fee,,,False,Faber and Faber,False,False,Independent Publishing House,"The Bindery, 51 Hatton Garden, London EC1N 8HN",False,https://interests-api.parliament.uk/api/v1/Interests/5606,,,,,,,
5729,Legal services - CGS Solicitors,,,2024-05-13,,Employment and earnings,1508,Sir Geoffrey Cox,Legal services,,,False,CGS Solicitors,False,False,,"4th Floor, 1 Minster Court, Mincing Lane, London EC3R 7AA",,https://interests-api.parliament.uk/api/v1/Interests/5729,,,,,,,
5727,Legal services - Bortoft Bell Solicitors,,,2024-05-13,,Employment and earnings,1508,Sir Geoffrey Cox,Legal services,,,False,Bortoft Bell Solicitors,False,False,,"2 John Street, London WC1N 2ES",,https://interests-api.parliament.uk/api/v1/Interests/5727,,,,,,,
5638,Speaker - Chartwell Speakers,,2024-05-07,2024-05-09,,Employment and earnings,4020,George Freeman,Speaker,2024-04-22,,False,Chartwell Speakers,False,False,speaker bureau and literary agency,"WeWork, Colonnade Walk, 123 Buckingham Palace Road, London SW1W 9SH",True,https://interests-api.parliament.uk/api/v1/Interests/5638,,,,,,,
5629,Consultant - Education Development Trust,,2024-05-07,2024-05-07,,Employment and earnings,111,Nick Gibb,Consultant,2024-05-01,2025-05-31,True,Education Development Trust,False,False,EDT is a global education consultancy,"Highbridge House, 16-18 Duke Street, Reading RG1 4BU",True,https://interests-api.parliament.uk/api/v1/Interests/5629,,,,,,,
5546,Writing a book - Biteback Publishing,,2024-04-29,2024-04-29,,Employment and earnings,4070,Matt Hancock,Writing a book,,,False,Biteback Publishing,False,False,book publishers,"c/o BCA, 21 Marina Court, Castle Street, Hull HU1 1TJ",,https://interests-api.parliament.uk/api/v1/Interests/5546,,,,,,,
5555,Consultant - World Gold Council,,2024-04-29,2024-04-29,,Employment and earnings,4007,Dominic Raab,Consultant,2024-04-29,,False,World Gold Council,False,False,international trade association,"7th Floor, 15 Fetter Lane, London EC4A 1BW",True,https://interests-api.parliament.uk/api/v1/Interests/5555,,,,,,,
5459,"Chair of University Council (RHUL) - Royal Holloway, University of London",,2024-04-24,2024-04-24,,Employment and earnings,140,Baroness Hodge of Barking,Chair of University Council (RHUL),2018-11-21,2027-11-21,True,"Royal Holloway, University of London",False,True,,"Egham Hill, Egham, TW20 0EX",,https://interests-api.parliament.uk/api/v1/Interests/5459,,,,,,,
5421,Chair of Science and Technology Advisory Board - Eastern Powerhouse,,,2024-04-24,,Employment and earnings,4020,George Freeman,Chair of Science and Technology Advisory Board,2024-03-18,,False,Eastern Powerhouse,False,False,,"42 Tavistock Street, London WC2E 7PB",True,https://interests-api.parliament.uk/api/v1/Interests/5421,,,,,,,
5388,Speaking Engagement - WA Communications,,,2024-04-23,,Employment and earnings,4943,Simon Lightwood,Speaking Engagement,,,False,WA Communications,False,False,,"6th Floor, Artillery House, Artillery Row, London SW1P 1RT",,https://interests-api.parliament.uk/api/v1/Interests/5388,,,,,,,
5355,Writing a book - Bonnier Books,,2024-04-17,2024-04-23,,Employment and earnings,435,Lord Brady of Altrincham,Writing a book,,,False,Bonnier Books,False,False,Publisher of Books and the company will be publishing my forthcoming book in November 2024,"Suite 7, The Plaza, 535 Kings Road, London SW10 0SZ",,https://interests-api.parliament.uk/api/v1/Interests/5355,,,,,,,
5320,Royalties for a book - David Luxton,,,2024-04-19,,Employment and earnings,4040,Chris Evans,Royalties for a book,,,False,David Luxton,False,False,Literary Agent,"First Floor, Jebsen House, 53-61 High Street, Ruislip, Middlesex, England, HA4 7BD",,https://interests-api.parliament.uk/api/v1/Interests/5320,,,,,,,
5389,Consultant providing strategic advice - Merkur Gaming UK Limited,,2024-04-18,2024-04-19,,Employment and earnings,1565,Sir Philip Davies,Consultant providing strategic advice,2024-04-15,,False,Merkur Gaming UK Limited,False,False,Arcade Games,"Fortune House, Northgate Terrace, Newark On Trent, Nottinghamshire, England, NG24 2EU",,https://interests-api.parliament.uk/api/v1/Interests/5389,,,,,,,
4482,Library copyright fees - Public Lending Right,,,2024-04-18,,Employment and earnings,4370,Jess Phillips,Library copyright fees,,,False,Public Lending Right,False,False,,"British Library, Boston Spa, Wetherby LS23 7BQ",,https://interests-api.parliament.uk/api/v1/Interests/4482,,,,,,,
3837,Speaking engagements - Chartwell Speakers,,2023-06-20,2024-04-15,2024-04-10,Employment and earnings,4097,Elizabeth Truss,Speaking engagements,,,False,Chartwell Speakers,False,False,,"Colonnade Walk, 123 Buckingham Place Road, London SW1W 9SH",True,https://interests-api.parliament.uk/api/v1/Interests/3837,,,,,,,
5123,Director - Impero Holdings Ltd,,,2024-04-15,2024-04-15,Employment and earnings,3912,Richard Fuller,Director,2023-04-01,2024-03-31,True,Impero Holdings Ltd,False,True,a software company,"2 Tollhouse Hill, Nottingham NG1 5FS",,https://interests-api.parliament.uk/api/v1/Interests/5123,,,,,,,
4680,Chair of the Parliamentary Advisory Board (formerly Editor) of the House Magazine - Political Engagement Ltd (previously Dods Group Limited),,,2024-04-15,2015-05-31,Employment and earnings,435,Lord Brady of Altrincham,Chair of the Parliamentary Advisory Board (formerly Editor) of the House Magazine,2021-02-15,,False,Political Engagement Ltd (previously Dods Group Limited),False,False,,"11th Floor, Millbank, London SW1P 4QP",,https://interests-api.parliament.uk/api/v1/Interests/4680,2015-11-13,2017-06-18,2017-07-03,2020-06-18,2020-12-15,2021-03-04,2024-03-19
5298,Writing one article - Daily Express,,,2024-04-15,,Employment and earnings,4743,Lee Anderson,Writing one article,,,False,Daily Express,False,False,,"One Canada Square, Canary Wharf, London E14 5AP",,https://interests-api.parliament.uk/api/v1/Interests/5298,,,,,,,
4861,Adviser - Centricus Partners LP through its UK subsidiary Centricus Services UK Limited,,2023-03-20,2024-04-15,2024-04-10,Employment and earnings,3945,Sir Sajid Javid,Adviser,2023-03-06,,False,Centricus Partners LP through its UK subsidiary Centricus Services UK Limited,False,False,global investment firm,"IFC 5, St. Helier, Jersey JE1 1ST",True,https://interests-api.parliament.uk/api/v1/Interests/4861,,,,,,,
5309,Senior Consultant - Blackfords LLP,,2024-04-15,2024-04-15,,Employment and earnings,4116,Sir Michael Ellis,Senior Consultant,2024-04-15,,False,Blackfords LLP,False,False,legal firm,"20 Old Bailey, London, EC4M 7AN",True,https://interests-api.parliament.uk/api/v1/Interests/5309,,,,,,,
5282,Practice at the Bar of England and Wales - Thomas More Chambers,,,2024-04-14,2023-08-02,Employment and earnings,1508,Sir Geoffrey Cox,Practice at the Bar of England and Wales,,,False,Thomas More Chambers,False,False,,"7 Lincoln's Inn Fields, London WC2A 3BP",,https://interests-api.parliament.uk/api/v1/Interests/5282,2024-04-12,,,,,,
5212,Non-executive director - Route to Zero,,2024-04-11,2024-04-14,,Employment and earnings,4659,Andrew Lewer,Non-executive director,2024-03-18,,False,Route to Zero,False,True,,"86-90, Paul St, London EC2A 4NE",,https://interests-api.parliament.uk/api/v1/Interests/5212,,,,,,,
5193,Writing articles - Telegraph Media Group Ltd,,,2024-04-10,2024-04-25,Employment and earnings,4475,Suella Braverman,Writing articles,,,False,Telegraph Media Group Ltd,False,False,,"111 Buckingham Palace Road, London SW1W 0DT",True,https://interests-api.parliament.uk/api/v1/Interests/5193,,,,,,,
5144,Speaking Engagement - British Council for Africa,,2024-04-08,2024-04-10,,Employment and earnings,1559,Sir James Duddridge,Speaking Engagement,,,False,British Council for Africa,False,False,"promotes African business, trade and commerce","59-60, Russell Square, London WC1B 4HP",,https://interests-api.parliament.uk/api/v1/Interests/5144,,,,,,,
5169,Speaking engagements - Coulthwaite Group Ltd,,2024-04-09,2024-04-10,,Employment and earnings,4097,Elizabeth Truss,Speaking engagements,,,False,Coulthwaite Group Ltd,True,False,,,True,https://interests-api.parliament.uk/api/v1/Interests/5169,,,,,,,
5142,Legal Services - Director of Public Prosecutions Mauritius,,,2024-04-09,,Employment and earnings,1508,Sir Geoffrey Cox,Legal Services,2023-09-01,2024-02-29,True,Director of Public Prosecutions Mauritius,False,False,,"Level 10, 16 Garden Tower Building, Poudriere St, Port Louis, Mauritius",,https://interests-api.parliament.uk/api/v1/Interests/5142,,,,,,,
5060,"Speaking at the International Futures Industry Conference in Boca Raton, Florida, United States (9-11 March 2024) - Future Industry Association",,2024-03-22,2024-04-08,,Employment and earnings,223,Sir Liam Fox,"Speaking at the International Futures Industry Conference in Boca Raton, Florida, United States (9-11 March 2024)",,,False,Future Industry Association,False,False,,"2001 K Street, NW, Suite 725, North Tower, Washington, DC, 20006",,https://interests-api.parliament.uk/api/v1/Interests/5060,,,,,,,
4907,"Senior Advisor providing advice on geopolitical and economic trends and strategic projects, and supporting discussions with current and potential portfolio companies. - EQT AB",,,2024-03-29,,Employment and earnings,4014,Lord Sharma,"Senior Advisor providing advice on geopolitical and economic trends and strategic projects, and supporting discussions with current and potential portfolio companies.",2024-03-01,,False,EQT AB,False,False,private markets investment firm,"Regeringsgatan 25, SE-11153, Stockholm, Sweden",True,https://interests-api.parliament.uk/api/v1/Interests/4907,,,,,,,
5149,Director (currently unpaid) - SARISA Limited,,2024-04-02,2024-03-29,2024-05-07,Employment and earnings,4446,Mr Marcus Fysh,Director (currently unpaid),2024-03-16,,False,SARISA Limited,False,True,high assurance engineering,"6 New Street Square, New Fetter Lane, London EC4A 3BF",,https://interests-api.parliament.uk/api/v1/Interests/5149,,,,,,,
5034,Training sessions for NHS professionals - Eden & Partners Ltd,,2024-03-25,2024-03-28,,Employment and earnings,114,Tim Loughton,Training sessions for NHS professionals,,,False,Eden & Partners Ltd,False,False,,"Snells Cottage, The Green, Newick, Lewes BN8 4LA",,https://interests-api.parliament.uk/api/v1/Interests/5034,,,,,,,
4545,Writing a book - A M Heath & Company Limited,,2024-03-21,2024-03-28,,Employment and earnings,3930,Caroline Lucas,Writing a book,,,False,A M Heath & Company Limited,False,False,literary agent,"6 Warwick Court, London WC1R 5DJ",,https://interests-api.parliament.uk/api/v1/Interests/4545,,,,,,,
4989,Speaking event on 29 February 2024 - Bruin Capital Holdings,,2024-03-20,2024-03-27,2024-03-28,Employment and earnings,1539,Mr Ben Wallace,Speaking event on 29 February 2024,,,False,Bruin Capital Holdings,False,False,,"7 Renaissance Square, 2nd Floor, White Plains, NY 10601",,https://interests-api.parliament.uk/api/v1/Interests/4989,,,,,,,
4480,Royalties,,,2024-03-26,,Employment and earnings,4370,Jess Phillips,Royalties,,,False,Authors' Licensing and Collecting Society (ALCS),False,False,Collection of copyright payments for authors,"6th Floor, International House, 1 St Katharine's Way, London E1W 1UN",False,https://interests-api.parliament.uk/api/v1/Interests/4480,,,,,,,
4884,Guest speaker at the International Military Chiefs of Chaplains Conference in Stuttgart on 8 February 2024. - The Religious Freedom Institute (RFI USA),,2024-03-15,2024-03-26,,Employment and earnings,3987,Rehman Chishti,Guest speaker at the International Military Chiefs of Chaplains Conference in Stuttgart on 8 February 2024.,,,False,The Religious Freedom Institute (RFI USA),False,False,,"316 Pennsylvania Ave, STE 501, Washington DC 20003, United States",,https://interests-api.parliament.uk/api/v1/Interests/4884,,,,,,,
5025,Legal consultant - Bird and Bird LLP,,,2024-03-18,2024-05-15,Employment and earnings,1560,Sir Jeremy Wright,Legal consultant,2022-10-06,2024-05-07,True,Bird and Bird LLP,False,False,Law firm,"12 New Fetter Lane, London EC4A 1JP",,https://interests-api.parliament.uk/api/v1/Interests/5025,,,,,,,
4720,Chairman - Pembroke VCT plc,,2015-06-03,2024-03-18,,Employment and earnings,1425,Mr Jonathan Djanogly,Chairman,,,False,Pembroke VCT plc,False,False,A venture capital trust,"3 Cadogan Gate, London SW1X 0AS",,https://interests-api.parliament.uk/api/v1/Interests/4720,,,,,,,
4722,"Partner - Gatley Farms, farming partnership",,2015-05-01,2024-03-18,,Employment and earnings,1542,Philip Dunne,Partner,,,False,"Gatley Farms, farming partnership",True,False,,,,https://interests-api.parliament.uk/api/v1/Interests/4722,,,,,,,
4865,Consultant paediatrician,,2017-01-09,2024-03-18,2017-04-27,Employment and earnings,4592,Dr Caroline Johnson,Consultant paediatrician,,,False,North West Anglia NHS Foundation Trust,False,False,,"Peterborough City Hospital, Bretton Gate, Bretton, PE3 9GZ",,https://interests-api.parliament.uk/api/v1/Interests/4865,2017-07-06,2020-03-13,2021-11-16,2022-06-21,2022-10-07,2023-10-26,
4375,Writing articles,,,2024-03-18,,Employment and earnings,4370,Jess Phillips,Writing articles,,,False,Guardian News & Media Ltd,False,False,,"Kings Place, 90 York Way, London N1P 2AP",,https://interests-api.parliament.uk/api/v1/Interests/4375,,,,,,,
4392,Writing articles - Daily Telegraph,,2023-07-12,2024-03-18,,Employment and earnings,4007,Dominic Raab,Writing articles,,,False,Daily Telegraph,False,False,,"111 Buckingham Palace Road, London SW1W 0DT",,https://interests-api.parliament.uk/api/v1/Interests/4392,,,,,,,
3818,Member of the Advisory Board of the House Magazine - Political Engagement Limited,,2021-07-01,2024-03-18,2022-12-09,Employment and earnings,4110,Dame Karen Bradley,Member of the Advisory Board of the House Magazine,2021-05-12,,False,Political Engagement Limited,False,False,,"11th Floor, Millbank Tower, 21-24 Millbank, London SW1P 4QP",True,https://interests-api.parliament.uk/api/v1/Interests/3818,2023-10-19,,,,,,
3833,Royalty payments - Springer Nature Ltd,,2023-05-05,2024-03-18,,Employment and earnings,4097,Elizabeth Truss,Royalty payments,,,False,Springer Nature Ltd,False,False,,"The Campus, 4 Crinan Street, London N1 9XW",,https://interests-api.parliament.uk/api/v1/Interests/3833,,,,,,,
4932,Academic Work - Liberty Fund Inc,,,2024-03-18,,Employment and earnings,3991,Jesse Norman,Academic Work,,,False,Liberty Fund Inc,False,False,private educational foundation,"11301 N. Meridian Street, Carmel, IN 46032-4564, USA",,https://interests-api.parliament.uk/api/v1/Interests/4932,,,,,,,
5002,Non-executive director - Rentplus-UK Ltd,,2019-04-24,2024-03-18,2020-05-21,Employment and earnings,234,Sir Gary Streeter,Non-executive director,2019-04-15,,False,Rentplus-UK Ltd,False,True,A company which provides rent to buy housing for young people,"II Exchange Square, 21 North Fourth Street, Milton Keynes MK9 1HL",,https://interests-api.parliament.uk/api/v1/Interests/5002,2022-01-28,2024-01-30,,,,,
4849,Strategic Adviser - BB Energy Trading Ltd,,,2024-03-18,,Employment and earnings,350,Sir John Hayes,Strategic Adviser,2018-09-01,,False,BB Energy Trading Ltd,False,False,an international energy company trading worldwide,"12-14 Ansdell St, London W8 5BN",True,https://interests-api.parliament.uk/api/v1/Interests/4849,,,,,,,
4081,Presenting seminars,,,2024-03-18,,Employment and earnings,3940,Craig Whittaker,Presenting seminars,,,False,Betting and Gaming Council,False,False,,"1 Bedford Row, London WC1R 4BU",,https://interests-api.parliament.uk/api/v1/Interests/4081,,,,,,,
4130,Appearing in a drama - ITV,,2024-01-04,2024-03-18,,Employment and earnings,4113,Nadhim Zahawi,Appearing in a drama,,,False,ITV,False,False,,"ITV White City, 201 Wood Lane, London W12 7RU",,https://interests-api.parliament.uk/api/v1/Interests/4130,,,,,,,
4181,Legal services,,,2024-03-18,,Employment and earnings,1508,Sir Geoffrey Cox,Legal services,,,False,CMS Holborn Asia,False,False,,"Holborn Law LLC, 7 Straights View, Marina One East Tower, #19-01, 018936, Singapore",,https://interests-api.parliament.uk/api/v1/Interests/4181,,,,,,,
4408,Presenting a TV programme - GB News,,2023-04-25,2024-03-18,,Employment and earnings,4099,Sir Jacob Rees-Mogg,Presenting a TV programme,,,False,GB News,False,False,,"2 Swan Lane, London EC4R 3TT",,https://interests-api.parliament.uk/api/v1/Interests/4408,,,,,,,
3869,Speaking engagements - Coulthwaite Group Pte Ltd (trading as CWG Speakers),,,2024-03-18,2024-05-02,Employment and earnings,4475,Suella Braverman,Speaking engagements,,,False,Coulthwaite Group Pte Ltd (trading as CWG Speakers),False,False,,"21 Woodlands Close, #08- 44, Primz Bizhub Singapore 737854",True,https://interests-api.parliament.uk/api/v1/Interests/3869,,,,,,,
4341,Surgeon Commander - Royal Naval Reserve,,,2024-03-18,2014-01-15,Employment and earnings,1466,Dr Andrew Murrison,Surgeon Commander,,,False,Royal Naval Reserve,False,False,,"HMS President, St Katherine’s Dock, London",,https://interests-api.parliament.uk/api/v1/Interests/4341,2015-10-02,,,,,,
5011,Managing Director and Board Director - Emerging Asset Management Ltd,,2015-11-28,2024-03-18,2017-01-26,Employment and earnings,1428,Sir Bill Wiggin,Managing Director and Board Director,2015-11-21,,False,Emerging Asset Management Ltd,False,True,,"58 Par-la-Ville Road, 4th floor, Vallis Building, Hamilton, Bermuda",,https://interests-api.parliament.uk/api/v1/Interests/5011,2017-11-13,2018-02-08,2019-01-07,2019-02-26,2021-11-08,2023-05-30,
3780,Speaking engagement,,,2024-03-18,,Employment and earnings,4014,Lord Sharma,Speaking engagement,,,False,Chartwell Partners Ltd,False,False,,"Unit 28, Colonnade Walk, 123 Buckingham Palace Road, London SW1W 9SH",,https://interests-api.parliament.uk/api/v1/Interests/3780,,,,,,,
4511,Writing articles - Reach Shared Services,,2024-03-11,2024-03-18,,Employment and earnings,4060,Sir Jake Berry,Writing articles,,,False,Reach Shared Services,False,False,,"1st Floor, 5 St Paul’s Square, Liverpool L3 9SJ",,https://interests-api.parliament.uk/api/v1/Interests/4511,,,,,,,
4693,Non-executive director,,2024-02-05,2024-03-18,,Employment and earnings,435,Lord Brady of Altrincham,Non-executive director,2024-02-01,2026-01-31,True,Medannex Limited,False,False,Scottish biopharmaceutical company,"1 Lochrin Square, Foutainbridge, Edinburgh EH3 9QA",,https://interests-api.parliament.uk/api/v1/Interests/4693,,,,,,,
4689,Adviser on Communications and Strategy,,2023-03-01,2024-03-18,,Employment and earnings,435,Lord Brady of Altrincham,Adviser on Communications and Strategy,2023-03-01,,False,Global Banking School Ltd and Metagedu Apprenticeships Ltd,False,False,,"891 Greenford Road, Greenford, London UB6 0HE",,https://interests-api.parliament.uk/api/v1/Interests/4689,,,,,,,
4218,Writing columns - Reach Group Limited,,2023-08-04,2024-03-18,,Employment and earnings,1565,Sir Philip Davies,Writing columns,,,False,Reach Group Limited,False,False,,"21st Floor, One Canada Square, Canary Wharf, London E14 5AP",,https://interests-api.parliament.uk/api/v1/Interests/4218,,,,,,,
4226,Presenting TV shows - GB News,,2023-05-04,2024-03-18,,Employment and earnings,1565,Sir Philip Davies,Presenting TV shows,,,False,GB News,False,False,,"Riverbank House, 2 Swan Lane, London EC4R 3TT",,https://interests-api.parliament.uk/api/v1/Interests/4226,,,,,,,
4978,Global Strategist - Charles Stanley,,2013-11-15,2024-03-18,,Employment and earnings,14,Lord Redwood,Global Strategist,2022-01-21,,False,Charles Stanley,False,False,"A UK investment manager owned by Raymond James, a quoted US company","55 Bishopsgate, London EC2N 3AS",,https://interests-api.parliament.uk/api/v1/Interests/4978,,,,,,,
5233,"Consultant, as part of LINK's independent Consumer Council - LINK Scheme Ltd",,2020-11-09,2024-03-18,,Employment and earnings,3926,Paul Maynard,"Consultant, as part of LINK's independent Consumer Council",2020-11-09,,False,LINK Scheme Ltd,False,False,,"RSM Central Square, 5th Floor, 29 Wellington Street, Leeds LS1 4DL",,https://interests-api.parliament.uk/api/v1/Interests/5233,,,,,,,
4903,Speaking engagements - Washington Speakers Bureau,,2020-01-10,2024-03-18,2020-10-08,Employment and earnings,8,Baroness May of Maidenhead,Speaking engagements,2019-12-04,,False,Washington Speakers Bureau,False,False,a speaking agency,"1663 Prince Street, Alexandria, VA 22314",True,https://interests-api.parliament.uk/api/v1/Interests/4903,,,,,,,
4836,Independent Non-executive Director - Super Sharp Space Systems,,,2024-03-18,,Employment and earnings,4074,Mark Garnier,Independent Non-executive Director,2023-09-01,,False,Super Sharp Space Systems,False,False,Low orbit Earth observation telescopes,"G0 Stirling House, Cambridge Innovation Park, Denney End Road, Waterbeach CB25 9PB",,https://interests-api.parliament.uk/api/v1/Interests/4836,,,,,,,
4845,Member of the Global Strategic Advisory Board - Banco Finantia,,2024-03-04,2024-03-18,,Employment and earnings,1585,Stephen Hammond,Member of the Global Strategic Advisory Board,2024-01-31,,False,Banco Finantia,False,False,,"11 Austin Friars, London EC2N 2HG",,https://interests-api.parliament.uk/api/v1/Interests/4845,,,,,,,
4844,Consultant - I Squared Capital Advisors (UK) LLP,,2023-08-24,2024-03-18,,Employment and earnings,1585,Stephen Hammond,Consultant,2023-07-30,,False,I Squared Capital Advisors (UK) LLP,False,False,Investment company,"6 Chesterfield Gardens, London W1J 5BQ",,https://interests-api.parliament.uk/api/v1/Interests/4844,,,,,,,
4985,Speaking at event on 16 November 2023 - N.M. Rothschild & Sons Ltd,,2023-12-22,2024-03-18,,Employment and earnings,1539,Mr Ben Wallace,Speaking at event on 16 November 2023,,,False,N.M. Rothschild & Sons Ltd,False,False,,"New Court, St Swithin’s lane, London EC4N 8AL",,https://interests-api.parliament.uk/api/v1/Interests/4985,,,,,,,
4683,Member of Advisory Board,,,2024-03-18,2021-06-24,Employment and earnings,435,Lord Brady of Altrincham,Member of Advisory Board,2022-05-01,,False,Primary Access and Research,False,False,,"64 Eaton Place, London SW1X 8AT",,https://interests-api.parliament.uk/api/v1/Interests/4683,2022-05-16,,,,,,
3880,Writing articles,,,2024-03-18,,Employment and earnings,1446,Chris Bryant,Writing articles,,,False,Reach Shared Services Limited,False,False,,"3rd Floor, 5 St Paul's Square, Liverpool L3 9SJ",,https://interests-api.parliament.uk/api/v1/Interests/3880,,,,,,,
4129,Appearing on a panel,,,2024-03-18,,Employment and earnings,1489,Dawn Butler,Appearing on a panel,,,False,DC Thompson Ltd,False,False,,"Meadowside, 2 Albert Square, Dundee DD1 1DD",,https://interests-api.parliament.uk/api/v1/Interests/4129,,,,,,,
3817,Speaking at a panel event - JLA Speakers Ltd,,2024-02-29,2024-03-18,,Employment and earnings,1609,Chloe Smith,Speaking at a panel event,,,False,JLA Speakers Ltd,False,False,,"14 Berners Street, London W1T 3LI",,https://interests-api.parliament.uk/api/v1/Interests/3817,,,,,,,
4067,Writing articles - Telegraph Media Group,,2023-11-01,2024-03-18,,Employment and earnings,1539,Mr Ben Wallace,Writing articles,,,False,Telegraph Media Group,False,False,,"111 Buckingham Palace Road, London SW1W 0DT",,https://interests-api.parliament.uk/api/v1/Interests/4067,,,,,,,
4736,Chairman - International Fugitive Emissions Abatement Association,,2023-12-27,2024-03-18,,Employment and earnings,3934,George Eustice,Chairman,2023-12-01,,False,International Fugitive Emissions Abatement Association,False,False,aims to reduce emissions,"31 Turnaware Road, Falmouth TR11 4PH",True,https://interests-api.parliament.uk/api/v1/Interests/4736,,,,,,,
4738,Attending meetings and providing written advice - Hornsearle Property Investments Ltd,,2024-02-21,2024-03-18,,Employment and earnings,3934,George Eustice,Attending meetings and providing written advice,,,False,Hornsearle Property Investments Ltd,False,False,social housing investor,"Reedham House, 31 King Street, Manchester M3 2PJ",True,https://interests-api.parliament.uk/api/v1/Interests/4738,,,,,,,
4828,Consultancy advice - World Climate Initiative,,,2024-03-18,,Employment and earnings,146,Barry Gardiner,Consultancy advice,2022-11-22,,False,World Climate Initiative,False,False,,"8th Floor, 167 Fleet Street, London EC3A 2EA",,https://interests-api.parliament.uk/api/v1/Interests/4828,,,,,,,
5019,Royalty payments,,,2024-03-18,,Employment and earnings,1440,Pete Wishart,Royalty payments,,,False,EMI,False,False,,"EMI House, 43 Brook Green, London W6 7EF",,https://interests-api.parliament.uk/api/v1/Interests/5019,,,,,,,
